{
  "schema": "shellx-motion/actions@1",
  "actionSchema": "shellx-motion/action@1",
  "generatedBy": "scripts/public/generate-public-contracts.ts",
  "actionCount": 174,
  "permissions": [
    "read_motion",
    "draft_motion",
    "render_motion",
    "edit_motion",
    "write_local",
    "push_remote"
  ],
  "surfaces": [
    "assets",
    "brand",
    "canvas",
    "compositing",
    "cut",
    "keying",
    "packages",
    "preview",
    "procedural",
    "prompt",
    "receipts",
    "review",
    "roto",
    "scene3d",
    "templateInspector",
    "timeline",
    "tracking"
  ],
  "actions": [
    {
      "id": "motion.actions.find",
      "aliases": [
        "find action",
        "what can motion do",
        "discover action"
      ],
      "permission": "read_motion",
      "mutates": false,
      "calls": [
        "motion.actions.find"
      ],
      "verify": [
        "Returns a matching action id or null."
      ],
      "surfaces": [
        "prompt"
      ]
    },
    {
      "id": "motion.actions.panel",
      "aliases": [
        "show prompt action panel",
        "prompt action panel",
        "action panel",
        "show action panel",
        "open action panel",
        "show action catalog",
        "show prompt tools"
      ],
      "permission": "read_motion",
      "mutates": false,
      "calls": [
        "motion.actions.panel"
      ],
      "verify": [
        "Action panel returns grouped actions, permission counts, explicit prompt-provider selection guidance, and health/selection follow-ups without a bare prompt run."
      ],
      "surfaces": [
        "prompt"
      ]
    },
    {
      "id": "motion.capabilities.match",
      "aliases": [
        "capabilities match",
        "renderer capability match",
        "choose renderer lane",
        "select renderer lane",
        "pick renderer lane",
        "choose renderer lane for mp4 with audio",
        "which renderer lane should I use",
        "explain renderer lane support",
        "check lane capability cards",
        "match motion package to render lane"
      ],
      "permission": "read_motion",
      "mutates": false,
      "calls": [
        "motion.capabilities.match"
      ],
      "verify": [
        "Capability match returns lane cards, output/audio/alpha fit, unsupported features, recommended lane, and frame-to-final pipeline when final encoding needs a frame lane."
      ],
      "surfaces": [
        "prompt",
        "preview"
      ]
    },
    {
      "id": "motion.capabilities.panel",
      "aliases": [
        "show renderer capability panel",
        "renderer capability panel",
        "show lane capability cards",
        "show render lane cards",
        "show capabilities panel",
        "inspect renderer lanes",
        "inspect lane support",
        "renderer lane panel"
      ],
      "permission": "read_motion",
      "mutates": false,
      "calls": [
        "motion.capabilities.panel"
      ],
      "verify": [
        "Capability panel returns grouped lane cards, support badges, package fit, recommended lane, and follow-up match/export actions."
      ],
      "surfaces": [
        "prompt",
        "preview"
      ]
    },
    {
      "id": "motion.agent.panel",
      "aliases": [
        "show local cli agent readiness panel",
        "show agent readiness panel",
        "agent readiness panel",
        "local cli agent panel",
        "show cli subscription agent policy",
        "show prompt agent policy",
        "inspect local agent adapters"
      ],
      "permission": "read_motion",
      "mutates": false,
      "calls": [
        "motion.agent.panel"
      ],
      "verify": [
        "Agent panel returns explicit prompt-provider selection policy, candidate source, adapter command shapes, safety guarantees, receipt coverage, and readiness/transcript follow-ups without probing or mutating packages."
      ],
      "surfaces": [
        "prompt"
      ]
    },
    {
      "id": "motion.agent.health",
      "aliases": [
        "check local cli agent health",
        "agent health",
        "check agent health",
        "local agent readiness",
        "codex claude grok readiness",
        "show cli subscription agent status"
      ],
      "permission": "read_motion",
      "mutates": false,
      "calls": [
        "motion.agent.health"
      ],
      "verify": [
        "Agent health returns local CLI subscription adapter readiness, transport, billing mode, and unavailable reasons without mutating packages."
      ],
      "surfaces": [
        "prompt"
      ]
    },
    {
      "id": "motion.agent.snapshot",
      "aliases": [
        "compact motion context",
        "motion agent snapshot",
        "summarize motion for agent",
        "show compact package receipts jobs",
        "agent context snapshot",
        "what should motion agent know"
      ],
      "permission": "read_motion",
      "mutates": false,
      "calls": [
        "motion.agent.snapshot"
      ],
      "verify": [
        "Agent snapshot returns a bounded path-free package, action, receipt, warning, and own-job summary without creating a receipt or mutating Motion."
      ],
      "surfaces": [
        "prompt"
      ]
    },
    {
      "id": "motion.agent.transcript",
      "aliases": [
        "show agent transcript",
        "agent transcript",
        "prompt transcript",
        "transcript panel",
        "show prompt run transcript",
        "inspect agent messages"
      ],
      "permission": "read_motion",
      "mutates": false,
      "calls": [
        "motion.agent.transcript",
        "motion.receipts.read"
      ],
      "verify": [
        "Agent transcript digest returns prompt and agent receipt links with redacted transcript messages."
      ],
      "surfaces": [
        "receipts",
        "prompt"
      ]
    },
    {
      "id": "motion.agent.revision.plan",
      "aliases": [
        "create agent revision plan",
        "critique render and revise",
        "make revision plan from quality receipt",
        "review contact sheet and quality receipt",
        "plan prompt revision",
        "agent critique revise loop"
      ],
      "permission": "write_local",
      "mutates": true,
      "calls": [
        "motion.agent.revision.plan",
        "motion.quality.check",
        "motion.prompt.run"
      ],
      "verify": [
        "Agent revision plan returns quality/contact-sheet findings, exact package/template ids, proposal-only mutation policy, and prompt-run follow-up actions before package mutation."
      ],
      "surfaces": [
        "receipts",
        "prompt",
        "review"
      ]
    },
    {
      "id": "motion.packages.browse",
      "aliases": [
        "browse motion packages",
        "package browser",
        "show package browser",
        "list motion packages",
        "show motion packages",
        "open package browser"
      ],
      "permission": "read_motion",
      "mutates": false,
      "calls": [
        "motion.packages.browse"
      ],
      "verify": [
        "Package browser returns package cards, template availability, asset counts, brand provenance, and skipped-package warnings."
      ],
      "surfaces": [
        "packages",
        "prompt"
      ]
    },
    {
      "id": "motion.timeline.panel",
      "aliases": [
        "show timeline panel",
        "timeline panel",
        "open timeline panel",
        "show scene layer timeline",
        "show scene and layer timeline",
        "show timeline layers"
      ],
      "permission": "read_motion",
      "mutates": false,
      "calls": [
        "motion.timeline.panel"
      ],
      "verify": [
        "Timeline panel returns playhead controls, scene and layer rows, markers, tracks, and suggested actions."
      ],
      "surfaces": [
        "timeline",
        "prompt"
      ]
    },
    {
      "id": "motion.timeline.keyframes.panel",
      "aliases": [
        "show keyframe panel",
        "keyframe panel",
        "show keyframes panel",
        "timeline keyframes panel",
        "inspect keyframe panel",
        "show animated keyframes",
        "inspect timeline keyframes",
        "show easing keyframes"
      ],
      "permission": "read_motion",
      "mutates": false,
      "calls": [
        "motion.timeline.keyframes.panel"
      ],
      "verify": [
        "Keyframe panel returns animated layers, target ranges, easing usage, preset counts, and suggested keyframe actions."
      ],
      "surfaces": [
        "timeline",
        "prompt"
      ]
    },
    {
      "id": "motion.timeline.transitions.panel",
      "aliases": [
        "show timeline transition panel",
        "timeline transition panel",
        "show transition panel",
        "transition panel",
        "show transitions panel",
        "timeline transitions panel",
        "inspect transition panel",
        "show enter exit transitions",
        "inspect timeline transitions",
        "show transition easing"
      ],
      "permission": "read_motion",
      "mutates": false,
      "calls": [
        "motion.timeline.transitions.panel"
      ],
      "verify": [
        "Transition panel returns layers with enter/exit transitions, timing windows, easing usage, type counts, and suggested transition actions."
      ],
      "surfaces": [
        "timeline",
        "prompt"
      ]
    },
    {
      "id": "motion.receipts.panel",
      "aliases": [
        "show receipt panel",
        "receipt panel",
        "receipts panel",
        "receipt summary",
        "show receipt summary",
        "summarize receipts"
      ],
      "permission": "read_motion",
      "mutates": false,
      "calls": [
        "motion.receipts.panel",
        "motion.receipts.read"
      ],
      "verify": [
        "Receipt panel summary returns counts, recent receipts, warnings, failures, and artifact links.",